ranking_code,source_ranking_slug,source_period_slug,source_type,source_id,target_type,rank_no,title,image_url,author_name,narrator_name,summary,source_url,jump_url,source
LR_RANK_DOWN_MONTH,down,month,book,81075991,album,7,狼群|刺血著|军旅,https://bookpic.lrts.me/2zH0dfnI6MglPCSNUeAHDxlnqCzLD0CS-1-81075991.png,佚名,夏至未央tt,新生代特种军旅小说最具影响力作品《狼群》，零距离透视雇佣军神秘生涯。一次意外的劫持，一场殊死的搏杀，将一个平凡的中国学生带入了战火纷飞的生命历程。血腥仍在继续，死,https://www.lrts.me/rank/down/month,https://www.lrts.me/book/81075991,lrts
LR_RANK_DOWN_MONTH,down,month,book,43916,album,8,斗罗大陆|网文之王|再铸辉煌,https://bookpic.lrts.me/jWkynpJsBK0HWycWE80q8kXf2gwZXNnC-1-43916.png,唐家三少,赞扬,玄幻+优质作品！网文界的销量神话，肖战、吴宣仪主演同名电视剧原著！网文之王唐家三少，重启“斗罗大陆”，再铸唐门辉煌！,https://www.lrts.me/rank/down/month,https://www.lrts.me/book/43916,lrts
LR_RANK_DOWN_MONTH,down,month,book,11268876,album,9,单田芳：白眉大侠|320回,https://bookpic.lrts.me/1iedfscuicXst1p2mnmuXXgqppiis03k.png,单田芳,单田芳,《白眉大侠》讲述了宋朝四帝仁宗皇帝执政期间，以徐良、白云瑞为书胆，包括七侠、大五义、小五义、小七杰等众开封府校尉，在八王赵德芳、包拯、颜查散等清官的支持下，为保国,https://www.lrts.me/rank/down/month,https://www.lrts.me/book/11268876,lrts
LR_RANK_DOWN_MONTH,down,month,book,27108887,album,10,单田芳：隋唐演义|150回,https://bookpic.lrts.me/8gmztbp9fyjl9qrgt6nqqd2o4kim65e1.png,单田芳,单田芳,《隋唐演义》评书讲述的是隋王朝临末日时，以瓦岗寨为首的起义军，联络朝中被隋炀帝迫害的将领，推翻隋朝，建立唐王朝的故事。 隋朝末年，朝廷腐败，炀帝昏庸，奸相宇文化及,https://www.lrts.me/rank/down/month,https://www.lrts.me/book/27108887,lrts
LR_RANK_DOWN_MONTH,down,month,book,40536306,album,11,单田芳：童林传|250回,https://bookpic.lrts.me/bvq1e2rjXc0eX3ii5rd7iXkXgi1e5mXb.png,单田芳,单田芳,"《童林传》评书说的是清康熙年间，童林（字海川）因贪恋赌博,将父亲气伤后被父亲赶走。他绝路逢生，不仅得到武林名士何道源、尚道明相救相帮，而且练就“八卦柳叶绵丝掌”、",https://www.lrts.me/rank/down/month,https://www.lrts.me/book/40536306,lrts
LR_RANK_DOWN_MONTH,down,month,book,47519825,album,12,芽芽睡前故事,https://bookpic.lrts.me/d01UaH48MelmoTx1s1zTEgL8EVHBJVtn-1-47519825.png,"安徒生,格林兄弟,芽芽故事团队",芽芽故事,恬静的仙蒂传递着善良，倔强的人鱼勇敢追梦，胆小的豌豆直面逆境，让芽芽睡前故事编织宝贝更美好的梦。,https://www.lrts.me/rank/down/month,https://www.lrts.me/book/47519825,lrts
LR_RANK_DOWN_MONTH,down,month,book,91434500,album,13,重生六零福气包：我在全球疯狂囤货,https://bookpic.lrts.me/LWAmShhk2uJNiRXWs26tIpBWg40eyyTL-1-91434500.png,佚名,大甜儿,女主看着四毛钱一斤的内蒙牛肉，空间仓库疯狂闪烁。 重生六零福气包，手握记者证玩转全球：莫斯科倒卖电视机，非洲收购咖啡豆，外交宴会上顺走总统专供红酒。 某天被军装大,https://www.lrts.me/rank/down/month,https://www.lrts.me/book/91434500,lrts
LR_RANK_DOWN_MONTH,down,month,book,54859411,album,14,七零空间|甜宠|穿越|家长里短|金手指|养崽虐渣|发家致富,https://bookpic.lrts.me/uZdfh1Qe7JMaaMXgg2JSQrKv47Bbktyg-1-54859411.png,佚名,薄荷尔,穿越成冉家三嫂，面对被原主虐得面黄肌瘦的三个娃和前线丈夫，苏彩彩用灵泉疗愈、空间改善生活，却惊觉三儿会写字背诗，还蹦出未来热词！\n张老婆子抢鞋骂娃，她当场甩巴掌,https://www.lrts.me/rank/down/month,https://www.lrts.me/book/54859411,lrts
LR_RANK_DOWN_MONTH,down,month,book,94023997,album,15,特种兵王|全书免费,https://bookpic.lrts.me/gMH0hd7b0676lSpe29UDUZKRMpVCFfJi-1-94023997.png,夜星下,晚安,宁城，唯一个靠走后门进入“狼牙”的男人，且看身世成谜的他如何闯出一片天，成为一代传奇！ “咳咳，不好意思，我觉得走后门挺好。”宁城道。 这是一个温情，刺激，搞,https://www.lrts.me/rank/down/month,https://www.lrts.me/book/94023997,lrts
LR_RANK_DOWN_MONTH,down,month,book,40346788,album,16,夜话灵异故事|午夜书场,https://bookpic.lrts.me/gm8qLpnEf3KjuC1AB9LCmtosZEhOYl1C-1-40346788.png,素锦商,灵宿有声,这里有一个又一个离奇的故事。 这里有一幕又一幕诡谲的画面。 《午夜书场》每天一个鬼故事，我们等待您的收听。,https://www.lrts.me/rank/down/month,https://www.lrts.me/book/40346788,lrts
LR_RANK_DOWN_ALL,down,all,book,7705,album,1,小寡妇惹上冷总裁,https://bookpic.lrts.me/PF6NwCR7WMd6NTdm8S0RcisnLrQswhs8-1-7705.png,雪娇儿,温小水,苏影湄丧夫后携女寄人篱下，因长相酷似总裁律昊天的仇敌而被卷入情感漩涡。被迫交易、囚禁报复中滋生暧昧，却遭未婚妻白忆雪设计远走法国。三年后她蜕变为商界精英归来，与律,https://www.lrts.me/rank/down/all,https://www.lrts.me/book/7705,lrts
LR_RANK_DOWN_ALL,down,all,book,29928,album,2,修罗特种兵,https://bookpic.lrts.me/wL8XdhXLDkZC1EYJzYXmccHcIoitoU3t-1-29928.png,叶无忧,筱博,修罗特种兵重回都市，身如鬼神的他是否能融入繁华，早已淡忘的朋友和家人，是否还能捡起，神秘的任务，队友的血仇，他将如何完成。,https://www.lrts.me/rank/down/all,https://www.lrts.me/book/29928,lrts
LR_RANK_DOWN_ALL,down,all,book,28059,album,3,尊道,https://bookpic.lrts.me/2a41e42f9d3942118175e163336c137f.jpg,人生谁伴,box,天地初衍，万物始行。清浊两分，化为三界。人间州府林立，山川妖兽横行。,https://www.lrts.me/rank/down/all,https://www.lrts.me/book/28059,lrts
LR_RANK_DOWN_ALL,down,all,book,36691,album,4,最后一个道士2：道门往事|神秘起源|身世揭秘|道门探秘|悬念迭起|热血追寻,https://bookpic.lrts.me/m1Lw8zSGKt02i2PFUC5N9MdnXfHEuLxI-1-36691.png,最爱MISIC伯爵,胖书生,本书讲述的是天正道最后一位掌门查文斌的故事，查文斌来自哪里？他又去了何方？天正道到底又是哪门哪派？,https://www.lrts.me/rank/down/all,https://www.lrts.me/book/36691,lrts
LR_RANK_DOWN_ALL,down,all,book,43916,album,5,斗罗大陆|网文之王|再铸辉煌,https://bookpic.lrts.me/jWkynpJsBK0HWycWE80q8kXf2gwZXNnC-1-43916.png,唐家三少,赞扬,玄幻+优质作品！网文界的销量神话，肖战、吴宣仪主演同名电视剧原著！网文之王唐家三少，重启“斗罗大陆”，再铸唐门辉煌！,https://www.lrts.me/rank/down/all,https://www.lrts.me/book/43916,lrts
LR_RANK_DOWN_ALL,down,all,book,31113,album,6,浅婚深爱,https://bookpic.lrts.me/aV6igzJ0CQPXmZbOSRNOWm4Ox88Lyw12-1-31113.png,陌上迟归,煎饺,一夜风流，陆轻澜睡了她辈分上的小叔叔，叶庭深。自此，被逼婚，被求婚，被亲眼见着男友背叛，哦，还有每天被调戏。,https://www.lrts.me/rank/down/all,https://www.lrts.me/book/31113,lrts
LR_RANK_DOWN_ALL,down,all,book,7211,album,7,奋斗在初唐,https://bookpic.lrts.me/Op5ec1WAmnsoJ8KEVk8CgZy5phUZ1N6n-1-7211.png,牛凳,冠冠,现代青年回到了大唐贞观年间，干着一份体面的衙门差事，正如金子在哪儿都能发光一般，他还是一个不小心，将整个大唐给玩转了……,https://www.lrts.me/rank/down/all,https://www.lrts.me/book/7211,lrts
LR_RANK_DOWN_ALL,down,all,book,7707,album,8,我的美女老板娘,https://bookpic.lrts.me/kgfmw3zvt0o6PU01z88EQzXQ21lu4kKq-1-7707.png,八骏穆天子,探月,老板是个超级大美女，为了把女老板变成老板娘，他凭着超人的武力值和过人的表演天赋，一路白手起家，制霸都市，风云天下。,https://www.lrts.me/rank/down/all,https://www.lrts.me/book/7707,lrts
LR_RANK_DOWN_ALL,down,all,book,28164,album,9,诡墓|识风水|择墓穴|活宝贝,https://bookpic.lrts.me/C5p2HLZG14brEFjX8o7A5onqdNMmTecO-1-28164.png,小小青蛇,大马金刀,唐老爷子从乱坟堆里捡回唐三成，不料捡回一个识风水择墓穴的活宝贝！,https://www.lrts.me/rank/down/all,https://www.lrts.me/book/28164,lrts
LR_RANK_DOWN_ALL,down,all,book,27182,album,10,重生之再许芳华,https://bookpic.lrts.me/W5dDpEp5rJWryWkBaSk9lG5bePZDCUtd-1-27182.png,刹时红瘦,爱莎,谋杀亲夫、畏罪服毒——苏旖景的人生，就此惨淡落幕。皆因得不识好歹、又遇那“如意狼君”——却幸能豆蔻重生。,https://www.lrts.me/rank/down/all,https://www.lrts.me/book/27182,lrts
LR_RANK_DOWN_ALL,down,all,book,32776,album,11,盛世嫡妃|盛世三部曲|超经典女频榜单,https://bookpic.lrts.me/LsqwloioQgnL4e7yoDWpJO2lS4HAZGdp-1-32776.png,凤轻,北落潇潇,前世为军人世家的特种军人，死后转生成拥有前世记忆的尚书府嫡长女叶三小姐叶璃，人称三无千金——无才无貌无德。 嫁与他，世人皆说绝配！她浅笑吟吟，他既已是我的人，那我,https://www.lrts.me/rank/down/all,https://www.lrts.me/book/32776,lrts
LR_RANK_DOWN_ALL,down,all,book,29001,album,12,翡翠王,https://bookpic.lrts.me/vBQJoYScbESq3qtFl5Nc395FmR5o7n7S-1-29001.png,步行天下,康宸,一次粗心大意让林跃时来运转，获得了透视异能，从此好运接踵而来，段段好运让他如鱼得水，在赌石界大放异彩，美女倒追，笑傲花丛。,https://www.lrts.me/rank/down/all,https://www.lrts.me/book/29001,lrts
LR_RANK_DOWN_ALL,down,all,book,30475,album,13,良田千顷,https://bookpic.lrts.me/8L9y5F5GYrUKxG44bvWcKS9VvxgfITn5-1-30475.png,坐酌泠泠水,腐眼看人基,随身带田，田边有泉；种菜种花，养鱼养虾；朝纳灵气，夕品清茶。淡定睿智女主，创业致富，只为在大唐盛世过上“良夫山泉有点田”的悠然生活。,https://www.lrts.me/rank/down/all,https://www.lrts.me/book/30475,lrts
LR_RANK_DOWN_ALL,down,all,book,30238,album,14,烟水寒|多人小说剧,https://bookpic.lrts.me/jMI0eFSGxkBUxQYzp91tLKxIFAds2lbD-1-30238.png,寒武记,CV饕餮,谁爱上了谁？谁为谁心伤？谁的后院倒了葡萄架？谁又上了谁的床？都道是金玉良缘，却是阴差阳错，上有苍穹！,https://www.lrts.me/rank/down/all,https://www.lrts.me/book/30238,lrts
LR_RANK_DOWN_ALL,down,all,book,7275,album,15,特种兵穿越之大宋亲王,https://bookpic.lrts.me/e9VwPWoBHt33YYanAZl1qZBaOJU4dWB7-1-7275.png,小城山人,书虫,靖康之祸，宋金之战，中原战火燃烧。赵家皇室全部被俘，信王赵榛苏醒而来，灵魂却是千年后的特种兵赵榛。,https://www.lrts.me/rank/down/all,https://www.lrts.me/book/7275,lrts
LR_RANK_MALE_WEEK,male,week,book,14058944,album,1,九龙抬棺|评书版,https://bookpic.lrts.me/nllwd4w0nPPUQh8871S4WscjQlUuaQ2t-1-14058944.png,九当家,时代文化,爷爷出殡那晚，张九阳抬着石碑在前引路，不敢回头看，因为身后抬棺的是八只恶鬼……,https://www.lrts.me/rank/male/week,https://www.lrts.me/book/14058944,lrts
LR_RANK_MALE_WEEK,male,week,book,37671,album,2,权路迷局|美人余香|官场岁月|绝路突围|梁健&项谨|一路青云,https://bookpic.lrts.me/2bba5fece32b4c8cbcd984bac67b7c5f.png,笔龙胆,鲸鱼有声书场,在基层混迹多年毫无晋升希望的梁健，被女友父母嫌弃，陷入低谷。一次偶然车祸，亮剑凑巧救了某位贵人之女儿，自此人生发生重大转折，接着更大好运来到，他得到区委女书记的欣,https://www.lrts.me/rank/male/week,https://www.lrts.me/book/37671,lrts
LR_RANK_MALE_WEEK,male,week,book,69867065,album,3,一号狂枭,https://bookpic.lrts.me/S2UISrEMjfMg2Uy0KCquzHev6zy7qJ1l-1-69867065.png,岁月永恒,酷匠听书,五年前，养父一家人被人灭门，九死一生的他被秦雨欣救回一条命，尔后被神秘人带走。 五年后，女儿的一条短信将他从刀光剑影的战场上召回了红尘俗世。,https://www.lrts.me/rank/male/week,https://www.lrts.me/book/69867065,lrts
LR_RANK_MALE_WEEK,male,week,book,35626997,album,4,开局小姨子逼我离婚|都市神作|奇门神医,https://bookpic.lrts.me/b95edc8847564283b5cb043648497f4a.png,北境,扶声文化,【都市+开局小姨子逼我离婚+神医+鉴宝+捡漏】雨夜，走投无路的叶锋欲跳河轻生，却遇神秘老人搭救，许诺以三年为期，来改变他的人生，破罐子破摔的叶锋选择相信，今日三年,https://www.lrts.me/rank/male/week,https://www.lrts.me/book/35626997,lrts
LR_RANK_MALE_WEEK,male,week,book,37318,album,5,万古天帝|重生复仇|破苍逆坤|凌天踏界,https://bookpic.lrts.me/j12mrj1tkl503uetwuvm0zvt0phn6ct0.png,佚名,果维文化,天界第一战神因功高震主，遭挚爱背叛死于洞房之夜。 聂天重生百年，再不做殿下之臣！破苍穹，逆乾坤，凌万天，踏万界！,https://www.lrts.me/rank/male/week,https://www.lrts.me/book/37318,lrts
LR_RANK_MALE_WEEK,male,week,book,95529664,album,6,我的七个姐姐绝色倾城|宠弟狂魔|守护姐姐|世界之王|热血逆袭|身份反转,https://bookpic.lrts.me/oFqLNYi8TTH2fNvB3IHQqcj7ykMTCBJ7-1-95529664.png,苏生奈何,必看小说,我有七个绝色倾城的姐姐，他们都是宠弟狂魔，却不知我早已成为了令世界颤抖的王！ 十五年前，你们带我如至亲，十五年后，换我来守护你们。,https://www.lrts.me/rank/male/week,https://www.lrts.me/book/95529664,lrts
LR_RANK_MALE_WEEK,male,week,book,22752835,album,7,凡人修仙传之仙界篇|杨洋金晨主演影视原著|动漫原著,https://bookpic.lrts.me/qu4zcvjgs6a1bknisfqrk40y8l86u9ik.png,佚名,北冥有声,韩立靠不懈努力以及小心谨慎的性格修炼成仙，飞升至仙界北寒仙域。 在仙界遭遇一名强者不敌逃跑，后来再次遭遇方磐等人伏击，元婴被封、记忆缺失跌落下界灵寰界。 通过修成,https://www.lrts.me/rank/male/week,https://www.lrts.me/book/22752835,lrts
LR_RANK_MALE_WEEK,male,week,book,78819529,album,8,阴阳刺青师|悬疑惊悚|玄幻+,https://bookpic.lrts.me/EbBfRWAOMnx9jgxa4nNIA0GjsSVPWBTT-1-78819529.png,墨大先生,作客文化,作品语言诙谐，嬉笑怒骂或高雅或市井，仰为阳春白雪，俯就下里巴人，人情世故练达，真情流露感人，每个人物都塑造的很丰满。,https://www.lrts.me/rank/male/week,https://www.lrts.me/book/78819529,lrts
LR_RANK_MALE_WEEK,male,week,book,92087588,album,9,重生84：一切都靠手|财富逆袭|商业崛起|时代机遇|回收家电致富|改革浪潮弄潮,https://bookpic.lrts.me/IrUsCuvSVIxwWoqLDk6jaydFrMXZ8e2y-1-92087588.png,金生水起,必看小说,亿万富豪功成名就的陈峰意外回到了1984年，回到了魂牵梦绕的结发妻子身边。 他有点发懵，这个漂亮的老婆怎么回事？ 重活一回，赚钱什么的不要太简单，从回收家电做起，,https://www.lrts.me/rank/male/week,https://www.lrts.me/book/92087588,lrts
LR_RANK_MALE_WEEK,male,week,book,10156602,album,10,寒门嫡女有空间|完结,https://bookpic.lrts.me/jk7beee6VIa9ePWXr51v9mraSnb85RSD-1-10156602.png,画笔敲敲,小啾主播女,身怀空间穿越古代的稻花，只想安安稳稳的在田野间过完这辈子，谁知竟有个当县令的父亲，于是被迫从乡下进了城！,https://www.lrts.me/rank/male/week,https://www.lrts.me/book/10156602,lrts
LR_RANK_MALE_WEEK,male,week,book,46664,album,11,永恒圣王|多人演播|妖典逆袭|仙魔颤抖|诸圣俯首,https://bookpic.lrts.me/f1582da4a1714b8ab15704aa7ec6eadc.png,雪满弓刀,骤雨惊弦,生来就是炮灰的人族少年，因为得到一部无上妖典，踏上修行之路。自此，一代妖孽崛起于天荒，令仙魔颤抖，诸圣俯首。 一朝尘尽光生，照破山河万朵！,https://www.lrts.me/rank/male/week,https://www.lrts.me/book/46664,lrts
LR_RANK_MALE_WEEK,male,week,book,38926,album,12,万道剑尊|大神作品|玄幻+作品,https://bookpic.lrts.me/ZDmduidq5ud23Ohd3OSnCToEznl8WGNo-1-38926.png,打死都要钱,紫曰,玄幻+优质作品！风格热血，构思别具一格。少年得大天造化诀，在逆境中崛起，在绝境中争得一线生机，战遍九天十地！,https://www.lrts.me/rank/male/week,https://www.lrts.me/book/38926,lrts
LR_RANK_MALE_WEEK,male,week,book,78664737,album,13,茅山天师搜妖记|悬疑灵异|多人精播小说玄幻+,https://bookpic.lrts.me/jzw4bMdtO6mh631Y4x5uSnJttUnPIIXT-1-78664737.png,佚名,梦生文化,阎王叫人三更死，我敢留人到五更！十年前，叶凌风被人陷害，只得舍身入道门，成为一名茅山弟子；十年后，叶凌风学成归来，道法通玄，上可以动天地，下可以撼山川，明可以役龙,https://www.lrts.me/rank/male/week,https://www.lrts.me/book/78664737,lrts
LR_RANK_MALE_WEEK,male,week,book,43982689,album,14,嫡女杀疯了，渣男全家祭天|爽文,https://bookpic.lrts.me/49dd5ba8728143f1af9e7cbfd32bfba4.png,佚名,趣阅有声,药侯嫡女半夏，被姐姐跟心爱的太子哥哥谋害至死。再次醒来，重生到回都京的前几天。她带着上辈子的记忆，撕开姐姐的美人皮，揭穿继母的假菩萨面。都京传言说她乡下土包子，她,https://www.lrts.me/rank/male/week,https://www.lrts.me/book/43982689,lrts
LR_RANK_MALE_WEEK,male,week,book,96098387,album,15,乡村怪谈|灵异经历|阴阳眼奇遇|玄学破局,https://bookpic.lrts.me/IovWNM9R5x5guVSO3ctRDHeno1h4juox-1-96098387.png,佚名,贰飞,我是个中医，同时也是名半吊子风水先生，我从小就可以看到一些不该看到的东西。 接下来，讲讲我这些年来所遭遇的种种灵异经历……,https://www.lrts.me/rank/male/week,https://www.lrts.me/book/96098387,lrts
LR_RANK_MALE_WEEK,male,week,book,85343766,album,16,万道龙皇|暴爽玄幻,https://bookpic.lrts.me/FbnFF2QNy8RIh4TjUQDwYpe47XA42ElF-1-85343766.png,牧童听竹,杨土豆_,本是少年废柴的陆鸣，因被青梅竹马的陆瑶夺取先天血脉，从此心中埋下深深仇恨。本以为此生无法修炼，结果无意中获得《战龙真诀》，从此开启自己的制霸之路。,https://www.lrts.me/rank/male/week,https://www.lrts.me/book/85343766,lrts
LR_RANK_MALE_WEEK,male,week,book,17550829,album,17,镇国神婿|楚尘|多播|爆款女婿文,https://bookpic.lrts.me/L0vjNpxxynrGIjDIbo9pOfd7hQfd7mXR-1-17550829.png,佚名,趣阅有声,华夏第一家族少主，天下第一奇门传人楚尘，学成下山途中，意外封印了自己的双魂五魄，当了五年的傻子上门女婿。,https://www.lrts.me/rank/male/week,https://www.lrts.me/book/17550829,lrts
LR_RANK_MALE_WEEK,male,week,book,84753974,album,18,龙王战神出狱|抖音爆款|爆款女婿文|多人有声剧,https://bookpic.lrts.me/wISXsu7jWvF0nbaeKPVTaROAx1FB40kt-1-84753974.png,大江大河,博易听书,三年前，陆飞为救母亲，被迫成为上门女婿，三年前，被亲生父亲逼迫，进入监狱。当他走出监狱的那一刻，整个世界都要为之颤抖！,https://www.lrts.me/rank/male/week,https://www.lrts.me/book/84753974,lrts
LR_RANK_MALE_WEEK,male,week,book,39343,album,19,提拔,https://bookpic.lrts.me/wVI5GDgKv3FvlSQjtDJ7H38aEJDqICHE-1-39343.png,佚名,雁栖鸣工作室,主人翁三代贫农，却也在精英人士密布的道路之中走出一条新路。 【专辑简介】 主人翁三代贫农，是个小人物，却能遇到了识货的女上司，一步步得到提拔，从一个小员工做起，步,https://www.lrts.me/rank/male/week,https://www.lrts.me/book/39343,lrts
LR_RANK_MALE_WEEK,male,week,book,33096029,album,20,穷书生家的彪悍娘子|爆笑穿越&精品多人有声剧|已完结,https://bookpic.lrts.me/5mPjGMjcLRXMQ0Sd9LjnXzcD6zFWGGh8-1-33096029.png,倾本贤淑,娴侃侃,书生扣出了5文钱买了一个婆娘，婆娘是死是活全凭天意。 书生穿着补丁长衫，闲庭漫步的走在小路上，回家能不能吃上饭，全凭运气！ 1文当10文的抠门书生无意间拥有了个不,https://www.lrts.me/rank/male/week,https://www.lrts.me/book/33096029,lrts
LR_RANK_MALE_MONTH,male,month,book,66090631,album,1,都市神医：开局九张婚书|神医下山|都市异能|偷香,https://bookpic.lrts.me/444e5028a2974f9a9867dec4f770f0ad.png,庄小贤,博易听书,开局九张婚书，但我心里只有小师妹啊！九个未婚妻谁知道是什么歪瓜裂枣，退婚，必须退婚！ 怀揣九张婚书的江羽毅然下山退婚，从此开启人生巅峰之路。 时隔多年，当无敌的江,https://www.lrts.me/rank/male/month,https://www.lrts.me/book/66090631,lrts
LR_RANK_MALE_MONTH,male,month,book,598,album,2,凡人修仙传|大灰狼演播|杨洋主演影视原著|大结局抢先听|忘语|仙侠修真|凡人流,https://bookpic.lrts.me/wMHbubjQA9LSlHbT5YiGKbGoFRzDjLdz-1-598.png,忘语,大灰狼,"一个普通山村小子，偶然下进入到当地江湖小门派，成了一名记名弟子。他以这样身份，如何在门派中立足,如何以平庸的资质进入到修仙者的行列，从而笑傲三界之中！ 凡人修仙传",https://www.lrts.me/rank/male/month,https://www.lrts.me/book/598,lrts
LR_RANK_MALE_MONTH,male,month,book,46664,album,3,永恒圣王|多人演播|妖典逆袭|仙魔颤抖|诸圣俯首,https://bookpic.lrts.me/f1582da4a1714b8ab15704aa7ec6eadc.png,雪满弓刀,骤雨惊弦,生来就是炮灰的人族少年，因为得到一部无上妖典，踏上修行之路。自此，一代妖孽崛起于天荒，令仙魔颤抖，诸圣俯首。 一朝尘尽光生，照破山河万朵！,https://www.lrts.me/rank/male/month,https://www.lrts.me/book/46664,lrts
LR_RANK_MALE_MONTH,male,month,book,75282712,album,4,女侠且慢|后宫|月半洋多人有声剧,https://bookpic.lrts.me/f13d2906ac09460885216a8f73a48e7d.png,关关公子,月半洋,“女侠且慢，你可知我是什么人？” “知道，女帝身边的宠臣，反贼头目的相好，江湖名门的少主。脚踏三只船，我砍得就是你！”,https://www.lrts.me/rank/male/month,https://www.lrts.me/book/75282712,lrts
LR_RANK_MALE_MONTH,male,month,book,95181566,album,5,大奉打更人|多人有声剧|破亿完结爆款|王鹤棣、田曦薇主演影视|卖报小郎君,https://bookpic.lrts.me/xuoGO6nNFJNzXgl3rLkXX5cPC35EmMeG-1-95181566.png,卖报小郎君,百里屠屠,这个世界，有儒；有道；有佛；有妖；有术士。 警校毕业的许七安幽幽醒来，发现自己身处牢狱之中，三日后流放边陲...... 他起初的目的是自保，顺便在这个没有人权的社,https://www.lrts.me/rank/male/month,https://www.lrts.me/book/95181566,lrts
LR_RANK_MALE_MONTH,male,month,book,87933246,album,6,星门|老鹰吃小鸡重磅新书|畅销榜作品|完结畅听,https://bookpic.lrts.me/39gHWKjVotRwZX6wUAm5dpg3z531dRvy-1-87933246.png,老鹰吃小鸡,于申威,【玄幻】好友离奇死亡，本是天之骄子的李皓为了查明真相，从高校退学加入了银城巡检司，并最终成为了一名巡夜人！,https://www.lrts.me/rank/male/month,https://www.lrts.me/book/87933246,lrts
LR_RANK_MALE_MONTH,male,month,book,68905314,album,7,农家丑妻|爽文|逆袭,https://bookpic.lrts.me/43T8cGwzl9KcBXJgqNpZSYDgJqtXqTdY-1-68905314.png,佚名,畅读书城,夏曦穿越以后，恨不得老天爷来道雷再把她劈死过去。丑就算了，竟然还成了孩子娘。更让她崩溃的是，竟然嫁了个白眼狼。,https://www.lrts.me/rank/male/month,https://www.lrts.me/book/68905314,lrts
LR_RANK_MALE_MONTH,male,month,book,27473813,album,8,我真没想重生啊|重生逆袭|青春抉择|情感纠葛|甜蜜邂逅|心动抉择,https://bookpic.lrts.me/FMG8FJlEuyESkN2Eueb8GRKC6GqfZXYs-1-27473813.png,佚名,创见未来,万万没想到，社会精英、钻石单身汉的陈汉升居然重生了，一觉醒来变成了高三毕业生。 十字路口的陈汉升也在犹豫，宝藏女孩沈幼楚和白月光萧容鱼，应该选择谁？,https://www.lrts.me/rank/male/month,https://www.lrts.me/book/27473813,lrts
LR_RANK_MALE_MONTH,male,month,book,44342835,album,9,超品巫师|跳大神|看相算命|风水堪舆|蛊术对决,https://bookpic.lrts.me/GTiJkpI3ZldJXSg9nZdxDApzeboTOHX9-1-44342835.png,九灯和善,大马金刀,十几年前，一个叫《爸爸在这儿》的节目几位父亲带着萌萌哒的小女孩走进了一个偏僻的小山村而一位山村小道士混入了其中。 十几年后，一个在道观长大却得到巫师传承的青年带着,https://www.lrts.me/rank/male/month,https://www.lrts.me/book/44342835,lrts
LR_RANK_MALE_MONTH,male,month,book,10871431,album,10,大明最强天团|父可敌国|于申威爆笑开讲,https://bookpic.lrts.me/HimBdIYUqkiFxWNKpOwNsufL03Z6J1AO-1-10871431.png,三戒大师,于申威-袏佑,刘伯温半年后就挂？你儿子朱标挂的也很快~。其实你孙子朱雄英挂的更早。额朱允文倒是没挂。不过...穿越者楚王朱桢看着一旁的四哥朱棣。再看看眼前的亲爹洪武大帝，有些无,https://www.lrts.me/rank/male/month,https://www.lrts.me/book/10871431,lrts
LR_RANK_MALE_MONTH,male,month,book,18664199,album,11,剑来|精品三播|动漫2剧情抢先听|对应第66集,https://bookpic.lrts.me/a1bb68c0f2e3496ca3f13d515f10eda2.png,佚名,TME有声剧场,收听指引： 动漫第二季的第8集，对应第96集：嫁衣女鬼 动漫第二季的第7集，对应第90集：天地有气 动漫第二季的第6集：对应第87集：阿良斩白玉京 动漫第2季剧情,https://www.lrts.me/rank/male/month,https://www.lrts.me/book/18664199,lrts
